{
  "$schema": "http://json-schema.org/draft-07/schema#",
  "additionalProperties": false,
  "definitions": {
    "BrokerContext": {
      "additionalProperties": false,
      "description": "Broker context provided by the client.",
      "properties": {
        "ClientProcessPath": {
          "description": "File path of the client process.",
          "maxLength": 2048,
          "type": [
            "string",
            "null"
          ]
        },
        "ClientVersion": {
          "description": "Version of the UniGetUI client.",
          "maxLength": 128,
          "type": [
            "string",
            "null"
          ]
        },
        "EffectiveUser": {
          "description": "Windows identity of the calling user.",
          "maxLength": 256,
          "minLength": 1,
          "type": "string"
        },
        "RequestedElevation": {
          "allOf": [
            {
              "$ref": "#/definitions/Elevation"
            }
          ],
          "description": "Elevation level requested."
        }
      },
      "required": [
        "EffectiveUser",
        "RequestedElevation"
      ],
      "type": "object"
    },
    "Elevation": {
      "description": "Requested elevation level.",
      "enum": [
        "Standard",
        "Elevated"
      ],
      "type": "string"
    },
    "PackageOperationStatus": {
      "enum": [
        "PackageOperationStatus"
      ],
      "type": "string"
    },
    "resourceId": {
      "maxLength": 128,
      "pattern": "^[A-Za-z0-9][A-Za-z0-9._:\\-]{0,127}$",
      "type": "string"
    },
    "semanticVersion": {
      "maxLength": 128,
      "pattern": "^(0|[1-9]\\d*)\\.(0|[1-9]\\d*)\\.(0|[1-9]\\d*)(?:-((?:0|[1-9]\\d*|\\d*[A-Za-z-][0-9A-Za-z-]*)(?:\\.(?:0|[1-9]\\d*|\\d*[A-Za-z-][0-9A-Za-z-]*))*))?(?:\\+([0-9A-Za-z-]+(?:\\.[0-9A-Za-z-]+)*))?$",
      "type": "string"
    },
    "statusRequestSchemaUri": {
      "enum": [
        "https://aka.ms/unigetui/package-operation-status-request.schema.1.0.json"
      ],
      "type": "string"
    }
  },
  "description": "Request to query the status of a previously submitted package operation.",
  "properties": {
    "$schema": {
      "allOf": [
        {
          "$ref": "#/definitions/statusRequestSchemaUri"
        }
      ],
      "description": "Status request schema URI constant."
    },
    "Broker": {
      "allOf": [
        {
          "$ref": "#/definitions/BrokerContext"
        }
      ],
      "description": "Broker context from the client."
    },
    "RequestId": {
      "allOf": [
        {
          "$ref": "#/definitions/resourceId"
        }
      ],
      "description": "The `requestId` of the original package operation to query."
    },
    "RequestType": {
      "allOf": [
        {
          "$ref": "#/definitions/PackageOperationStatus"
        }
      ],
      "description": "Must be `\"packageOperationStatus\"`."
    },
    "RequestVersion": {
      "allOf": [
        {
          "$ref": "#/definitions/semanticVersion"
        }
      ],
      "description": "Request syntax version (semver)."
    }
  },
  "required": [
    "$schema",
    "Broker",
    "RequestId",
    "RequestType",
    "RequestVersion"
  ],
  "title": "StatusRequest",
  "type": "object"
}